{
  "version": 12,
  "projectName": "Nova Analytics",
  "pageMeta": {
    "language": "es",
    "title": "Nova Analytics — decisiones con claridad",
    "description": "Landing page de ejemplo generada para probar el flujo Screenshot to Orbit JSON."
  },
  "tokens": {
    "colors": {
      "background": {
        "name": "Background",
        "value": "#0b0d12",
        "cssVar": "--color-background"
      },
      "surface": {
        "name": "Surface",
        "value": "#151922",
        "cssVar": "--color-surface"
      },
      "surfaceSoft": {
        "name": "Surface soft",
        "value": "#1d2330",
        "cssVar": "--color-surface-soft"
      },
      "text": {
        "name": "Text",
        "value": "#f7f5f1",
        "cssVar": "--color-text"
      },
      "muted": {
        "name": "Muted",
        "value": "#a3a8b5",
        "cssVar": "--color-muted"
      },
      "accent": {
        "name": "Accent",
        "value": "#ff5a36",
        "cssVar": "--color-accent"
      },
      "accentSoft": {
        "name": "Accent soft",
        "value": "#ffb5a3",
        "cssVar": "--color-accent-soft"
      },
      "line": {
        "name": "Line",
        "value": "#2b3240",
        "cssVar": "--color-line"
      }
    },
    "typography": {
      "familySans": {
        "name": "Sans principal",
        "value": "\"Inter\", sans-serif",
        "cssVar": "--font-family-sans"
      },
      "display": {
        "name": "Display",
        "value": "68px",
        "cssVar": "--font-display"
      },
      "heading": {
        "name": "Heading",
        "value": "42px",
        "cssVar": "--font-heading"
      },
      "bodyLarge": {
        "name": "Body large",
        "value": "19px",
        "cssVar": "--font-body-large"
      },
      "body": {
        "name": "Body",
        "value": "16px",
        "cssVar": "--font-body"
      },
      "small": {
        "name": "Small",
        "value": "13px",
        "cssVar": "--font-small"
      }
    },
    "spacing": {
      "xs": {
        "name": "XS",
        "value": "8px",
        "cssVar": "--space-xs"
      },
      "sm": {
        "name": "S",
        "value": "12px",
        "cssVar": "--space-sm"
      },
      "md": {
        "name": "M",
        "value": "20px",
        "cssVar": "--space-md"
      },
      "lg": {
        "name": "L",
        "value": "32px",
        "cssVar": "--space-lg"
      },
      "xl": {
        "name": "XL",
        "value": "56px",
        "cssVar": "--space-xl"
      },
      "xxl": {
        "name": "XXL",
        "value": "88px",
        "cssVar": "--space-xxl"
      }
    },
    "radius": {
      "sm": {
        "name": "Small",
        "value": "10px",
        "cssVar": "--radius-sm"
      },
      "md": {
        "name": "Medium",
        "value": "18px",
        "cssVar": "--radius-md"
      },
      "lg": {
        "name": "Large",
        "value": "30px",
        "cssVar": "--radius-lg"
      },
      "pill": {
        "name": "Pill",
        "value": "999px",
        "cssVar": "--radius-pill"
      }
    },
    "shadows": {
      "elevated": {
        "name": "Elevated",
        "value": "0 30px 90px rgba(0,0,0,.38)",
        "cssVar": "--shadow-elevated"
      },
      "soft": {
        "name": "Soft",
        "value": "0 18px 55px rgba(0,0,0,.22)",
        "cssVar": "--shadow-soft"
      }
    }
  },
  "assets": [
    {
      "id": "asset-hero-dashboard",
      "name": "Hero dashboard placeholder",
      "src": "https://picsum.photos/seed/nova-home-dashboard/1400/1050",
      "type": "image/jpeg",
      "alt": "Vista previa temporal del dashboard de analítica",
      "width": 1400,
      "height": 1050,
      "size": 0
    },
    {
      "id": "asset-story-team",
      "name": "Team story placeholder",
      "src": "https://picsum.photos/seed/nova-home-team/1200/900",
      "type": "image/jpeg",
      "alt": "Imagen temporal de un equipo revisando información",
      "width": 1200,
      "height": 900,
      "size": 0
    }
  ],
  "components": [],
  "globalClasses": [
    {
      "id": "class-content-stack",
      "name": "content-stack",
      "description": "Columna editorial compartida",
      "styles": {
        "base": {
          "display": "flex",
          "direction": "column",
          "alignItems": "flex-start",
          "gap": "var(--space-md)"
        }
      },
      "states": {}
    },
    {
      "id": "class-feature-card",
      "name": "feature-card",
      "description": "Superficie y espaciado de beneficios",
      "styles": {
        "base": {
          "minHeight": "260px",
          "display": "flex",
          "direction": "column",
          "justifyContent": "space-between",
          "gap": "var(--space-lg)",
          "paddingTop": "var(--space-lg)",
          "paddingRight": "var(--space-lg)",
          "paddingBottom": "var(--space-lg)",
          "paddingLeft": "var(--space-lg)",
          "background": "var(--color-surface-soft)",
          "borderRadius": "var(--radius-md)",
          "borderWidth": "1px",
          "borderColor": "var(--color-line)"
        }
      },
      "states": {}
    },
    {
      "id": "class-feature-label",
      "name": "feature-label",
      "description": "Numeración de beneficios",
      "styles": {
        "base": {
          "color": "var(--color-accent)",
          "fontFamily": "var(--font-family-sans)",
          "fontSize": "var(--font-small)",
          "fontWeight": 700,
          "letterSpacing": "1.4px"
        }
      },
      "states": {}
    },
    {
      "id": "class-feature-title",
      "name": "feature-title",
      "description": "Título de beneficios",
      "styles": {
        "base": {
          "color": "var(--color-text)",
          "fontFamily": "var(--font-family-sans)",
          "fontSize": "28px",
          "fontWeight": 700,
          "lineHeight": 1.15
        }
      },
      "states": {}
    }
  ],
  "nodes": [
    {
      "id": "hero-section",
      "type": "section",
      "name": "Hero",
      "htmlTag": "main",
      "ariaLabel": "Presentación principal",
      "styles": {
        "base": {
          "width": "100%",
          "minHeight": "760px",
          "display": "flex",
          "direction": "column",
          "justifyContent": "center",
          "alignItems": "center",
          "paddingTop": "var(--space-xxl)",
          "paddingRight": "var(--space-xl)",
          "paddingBottom": "var(--space-xxl)",
          "paddingLeft": "var(--space-xl)",
          "background": "var(--color-background)",
          "color": "var(--color-text)"
        },
        "tablet": {
          "minHeight": "680px",
          "paddingRight": "32px",
          "paddingLeft": "32px"
        },
        "mobile": {
          "minHeight": "auto",
          "paddingTop": "64px",
          "paddingRight": "20px",
          "paddingBottom": "64px",
          "paddingLeft": "20px"
        }
      },
      "children": [
        {
          "id": "hero-container",
          "type": "container",
          "name": "Hero content",
          "htmlTag": "div",
          "styles": {
            "base": {
              "width": "100%",
              "maxWidth": "1240px",
              "display": "grid",
              "gridColumns": 2,
              "gap": "var(--space-xl)",
              "alignItems": "center"
            },
            "tablet": {
              "gridColumns": 1,
              "gap": "48px"
            },
            "mobile": {
              "gridColumns": 1,
              "gap": "36px"
            }
          },
          "children": [
            {
              "id": "hero-copy",
              "type": "container",
              "name": "Hero copy",
              "htmlTag": "div",
              "styles": {
                "base": {}
              },
              "children": [
                {
                  "id": "hero-eyebrow",
                  "type": "text",
                  "name": "Hero eyebrow",
                  "htmlTag": "p",
                  "content": "INTELLIGENCE / WITHOUT THE NOISE",
                  "styles": {
                    "base": {
                      "color": "var(--color-accent)",
                      "fontFamily": "var(--font-family-sans)",
                      "fontSize": "var(--font-small)",
                      "fontWeight": 700,
                      "lineHeight": 1.2,
                      "letterSpacing": "1.8px"
                    }
                  }
                },
                {
                  "id": "hero-title",
                  "type": "heading",
                  "name": "Hero title",
                  "tag": "h1",
                  "htmlTag": "h1",
                  "content": "Tus datos, finalmente claros.",
                  "styles": {
                    "base": {
                      "maxWidth": "720px",
                      "color": "var(--color-text)",
                      "fontFamily": "var(--font-family-sans)",
                      "fontSize": "var(--font-display)",
                      "fontWeight": 700,
                      "lineHeight": 1.02,
                      "letterSpacing": "-3px",
                      "textWrap": "balance"
                    },
                    "tablet": {
                      "fontSize": "56px",
                      "letterSpacing": "-2px"
                    },
                    "mobile": {
                      "fontSize": "42px",
                      "letterSpacing": "-1.5px"
                    }
                  }
                },
                {
                  "id": "hero-description",
                  "type": "text",
                  "name": "Hero description",
                  "htmlTag": "p",
                  "content": "Convierte información dispersa en decisiones rápidas con un espacio de trabajo diseñado para equipos modernos.",
                  "styles": {
                    "base": {
                      "maxWidth": "620px",